Id,Observateur,Pays,Massif,Sommet/secteur,itinéraire,Orientation,Date,Heure,Description,Decl a distance,Distance décl,Caractéristique,Dénivelé,Origine principale,Origine secondaire,Alti départ,Commentaire zone départ,Epaisseur rupture,Epaisseur max rupture,Longueur rupture,Ecoulement principal,Commentaire type écoulement,Alti arrivée,Commentaire zone arrivée,Qualite neige,Commentaire qualité neige,Commentaire qualité transportée,Risque MF,latitude,longitude
1387900430588,Duclos Alain,France,Haute Maurienne,Pointe d'Andagne,Bord de piste des 3000,W,24/12/2013,13:30,"Fort transport de neige par le vent en cours.
Plaque de neige accumulée au cours des dernières heures, déclenchée involontairement lors de notre retour sur la piste (fermée). 
Le cocktail ""neige nouvelle"" sur ""couche fragile"" dans ""pente à plus de 30°"" fonctionne décidément très bien....
Attention à la situation particulièrement instable ces jours ci, là ou de la neige s'accumule suite aux précipitations et/ou au transport par le vent !!!  ",false,0,Plaque à vent,0,Skieur hors piste,,2890,,20,40,0,Dense,,2810,,Aucun,"Neige sèche accumullée par le vent, mais non portante à ski",,3 - MARQUE,45.353207,7.055049
1387807254256,Presse 20 Minutes Online,France,Vanoise,Doron de Chavière,Ritort - Pralognan-la-Vanoise,NW,22/12/2013,11:30,"Un skieur de randonnée a été emporté et tué par une avalanche au dessus du chalet d'alpage du Ritort sur la commune de Pralognan-la-Vanoise.<br>
Extrait du site du 20minutes : ""La victime [...] terminait un raid de trois jours en compagnie d'un ami lorsque qu'une avalanche s'est déclenchée, peu avant 11h30 au passage des deux hommes, l'emportant sur une centaine de mètres avant de l'ensevelir. Tous deux redescendaient du col d'Aussois, situé à 2.900 mètres d'altitude, en empruntant le Vallon des Prioux. La victime a été ensevelie sous un mètre de neige».<br>

L'intervention des secours organisée est capitale (ici les CRS), mais ne permet que rarement de sauver à temps les victimes complètement enfouies (même avec un chien). Nos amis du secours rappellent donc la priorité à l'auto-sauvetage (DVA, sonde pelle, etc.), pour dégager les victimes le plus rapidement possible. Ils apporteront ensuite l'aide et les soins nécessaires.<br>
Les photos ont été prises 2 jours plus tard. La cassure n'était plus visible car déjà recouverte par la tempête des derniers jours.",false,0,,0,Skieur rando.  descente,,2000,,0,0,0,,L'avalanche a suivi le talweg du Ruisseau du Ritort.,0,La victime a été retrouvée presque en bas de l'avalanche (100 à 150 m de dénivelée) ,,,,1 - FAIBLE,45.312574,6.683852
1387724527999,Presse 20 Minutes Online,France,Grandes Rousses,Alpe d'Huez,secteur de la Combe Charbonnière,T,21/12/2013,14:00,"""Un homme d'une quarantaine d'années est mort samedi en Isère, emporté par une avalanche alors qu'il pratiquait le speed riding""
""La coulée s'est déclenchée à son passage. Il a été emporté, puis enseveli par une plaque de neige. Il n'a pu être ranimé malgré l'intervention rapide des secours», a indiqué la direction de la station, qui a appelé à la prudence quant à la pratique du hors-piste.""",false,0,,0,Speed riding,,2500,,0,0,0,,,0,,,,,Inconnu,45.099985,6.118572
1387740717567,Bernard Peyre Guy,France,Belledonne,Belle Etoile,Montée au col de l'Aigleton,S,21/12/2013,,""", je me suis fait prendre par une avalanche ce samedi en montant au col de l'Aigleton à partir du Rivier d'Allemont.
Le manque de neige nous a obligé à traverser la forêt ski sur le sac.
A la sortie de la forêt  (1600 m), 30 cm de poudreuse et arrivée du soleil.
Quelques petites coulées de neige tombant des rochers du Pic de Pin.
Nous poursuivons la progression au fond du talweg, puis au moment où la vallée se resserre, nous montons en zig-zag, à l'abri de gros rochers. Il ne me semble pas possible de passer rive gauche car le torrent est découvert par endroits et les ponts de neige semblent incertains.
Vers 1950 m, une coulée plus importante entraine la neige jusqu'au sol et atteint une partie du groupe qui n'est pas encore à l'abri.
2 personnes sont emportées : une sera ""éjectée"" de l'avalanche, l'autre sera ensevelie sous environ 50 cm de neige au bout de 75 m de glissade.
Rapidement repérée car suivie des yeux, la personne sera sortie en 5 min sans dommage (perte d'un bâton de ski).
J'ai sous estimé le réchauffement et l'importance que pouvait prendre les coulées de neige humide.""

Merci Guy pour le témoignage !
",false,0,,0,Skieur rando.  montée,,1950,,30,0,0,Dense,,0,,Humide,,,2 - LIMITE,45.225691,6.038772
1386512102145,Parc National de la Vanoise,France,Vanoise,Col de Roche Noire, Champagny en Vanoise,SW,03/12/2013,16:00,"Plaque à vent déclenchée à distance lors de la descente du versant sud du col de Roche Noire.<br>
""Sur la photo, à gauche et vers le sommet de la plaque, on voit la trace de ski où j'ai fait demi-tour, après que la plaque soit partie. Mon collègue donne l'échelle. La montée s'est faite (en ski de randonnée) par le refuge de Plaisance et le versant nord. A la descente, nous avons vu d'autres plaques similaires, parties naturellement, plutôt sur les bosses et les talus de la piste d'alpage de la Glière que nous avons suivie à l'aval, jusqu'à Champagny le Haut.""<br>
Un fort vent d'est/sud-est avait soufflé le weekend précédent. 
",true,0,Plaque à vent,0,Skieur rando.  descente,,2500,,0,0,0,Dense,,0,,,,,2 - LIMITE,45.455528,6.813111
1388588732782,Cellard Sylvain,France,Mont Thabor,Col de la Vallée Etroite,La Replanette - Amont itinéraire d'accès au refuge du Thabor,NW,02/12/2013,13:30,"Au passage du dernier skieur, heureusement équipé d'un ABS...
Début de saison qui illustre l'instabilité qui perdurera ensuite.",false,0,,0,Skieur rando.  descente,,2450,,0,0,0,,,2340,,Aucun,,,Inconnu,45.12526,6.616226
1385669343620,JapanPeuf.com,Japon,Japon - Tateyama,Mont Masago,,NE,23/11/2013,10:55,"Une avalanche a fait 7 victimes dans le nord-ouest du Japon.
Plus de détails sur l'avalanche (dont une vidéo) sur le site de JapanPeuf.com : <a href=""http://japanpeuf.50.forumer.com/tateyama-avalanche-2013-11-23-t1304092.html"">ici</a>  <br> ainsi que sur le site de Japan Avalanche Network (dans le lien vers une description)",false,0,Plaque friable,0,Alpiniste,,0,,0,200,0,Mixte,,0,,,,,Inconnu,36.58469,137.6153
1382882940457,Gotti Christophe,France,Vanoise,Pointe du Génépy,Passage de Rosoire,W,26/10/2013,14:00,"Extrait de l'article du Dauphiné Libéré: ""Deux alpinistes [...] se tirent ce samedi pratiquement indemnes d'une avalanche qui les a surpris vers 14 heures, à quelques dizaines de mètres du passage de Rosoire, entre Tarentaise et Maurienne, au sommet du glacier du Génépy, à Pralognan-La Vanoise. La plaque de neige est partie sous leurs pieds, sur une largeur d'une centaine de mètres, sur environ 250 mètres de long, dans une pente à 45 degrés. ""A certains endroits, l'épaisseur de la couche de neige décrochée dépassait les deux mètres""indique-t-on chez les CRS du secours en montagne, en poste à Modane. Miraculeusement, les deux hommes n'ont pas été ensevelis. Ils ont pu se dégager seuls, et aussitôt prévenir les secours.""<br>
La trace de montée des deux alpinistes semble être sur l'extrémité gauche de la plaque.",false,0,,0,Alpiniste,,3460,,0,0,0,,,3350,,,,,Inconnu,45.30414,6.728187
1382289885396,Presse Dauphiné Libéré,France,Haute Tarentaise,Grande Motte,,NE,13/10/2013,,"""En début d'après-midi dimanche, quatre skieurs qui évoluaient sur un secteur hors-piste ont déclenché une avalanche.
L'un des jeunes hommes a été partiellement enseveli par la neige, mais est parvenu à se dégager avant l'arrivée des secours.""
Les skieurs hors pistes, bien équipés, sont montés à pied pour rejoindre la pente convoitée.
L'avalanche a développé un aérosol qui a atteint une piste, heureusmeent sans conséquences graves.
Arnaud Trinquier, directeur du service des pistes de Tignes, insiste encore sur la prudence dont devraient faire preuve les skieurs en dehors des zones sécurisées, PARTICULIEREMENT AU DESSUS DES PISTES OUVERTES. 
Même gérée avec professionnalisme, la sécurisation des pistes contre les avalanches assurée par les pisteurs peut être l'objet de failles imprévisibles.
Photos du ""secours"" par le service des pistes : 70 personnes et plusieurs chiens mobilisés.",false,0,,200,Skieur hors piste,,3600,,80,0,80,Mixte,,3400,,Sèche poudreuse,,,Inconnu,45.417169,6.881075
1382287820696,Presse Dauphiné Libéré,France,Mont Blanc,Mont Blanc du Tacul,Face Nord,N,13/08/2013,04:00,"""La coulée, provoquée par une chute de blocs de glace, a emporté un groupe d'au moins sept personnes qui évoluait sur la montagne. Les secouristes ont retrouvé dans une rimaye une cordée de trois alpinistes emportés par l'avalanche. """,false,0,,0,Chute de sérac,,3950,,0,0,0,,,3500,,,,,Inconnu,45.863437,6.878408
1371502161716,Duclos Alain,France,Haute Maurienne,Bonneval sur Arc,RD 902 - Accès au Col de l'Iseran ; Rocher des Hirondelles,SW,16/06/2013,,"Cette avalanche semble avoir glissé en fin de journée du dimanche.
La route avait été maintenue fermée à la circulation.",false,0,Plaque de fond,0,Réchauffement,,2380,,0,0,0,Dense,,2260,Blocs durs sur la chaussée ; environ 5 m au plus épais,Humide,,,Inconnu,45.400045,7.041448
1371044207845,Chenu Hervé,France,Lauzière,Col de la Madeleine,RD 94 - Couloir des Ardoisières,NE,11/06/2013,,"Avalanche descendue spontanément en après midi sur route jusque là fermée.
Nous surveillions cette plaque qui glissait depuis plusieurs semaines. La veille de son départ, elle n'était plus en appui que sur un pilier de neige précaire (cf photos).",false,0,Plaque de fond,0,Réchauffement,,1940,,0,0,0,Dense,,1850,,Humide,,,Inconnu,45.444398,6.377171
1370849251026,Duclos Alain,France,Haute Maurienne,Bonneval sur Arc,RD 902 - Accès au Col de l'Iseran ; secteur de La Met,S,05/06/2013,15:00,"Glissement de talus, ayant déposé un volume important sur la chaussée encore fermée à la circulation.",false,0,Plaque de fond,0,Réchauffement,,2025,,80,0,0,Dense,,1950,,Humide,,,Inconnu,45.375202,7.034319
1370335309346,André Luc,France,Vanoise,Aiguille de Polset,"Glacier de Polset, traversée depuis les pistes de Val Thorens",SW,02/06/2013,11:00,"La neige est encore froide et plutôt dure, peut être un peu accumulée et transformée par le vent. Montée avec les couteaux.
La neige de surface se met soudainement à glisser. Jean Claude parvient à s'accrocher à la pente et à ne pas être emporté. Luc est malheureusement entrainé. Il n'es pas enfoui, mais a heurté des rochers au passage : tibia et péroné fracturés ; pied à l'équerre. Secours héliporté un peu ""limite"" à cause d'une mer de nuages fluctuante (merci, une fois de plus, au secours aérien de Modane !). 
Mauvaise fin de saison pour ces deux randonneurs chevronnés...  heureux quand même que l'issue n'ait pas été pire.",false,0,,100,Skieur rando.  montée,,3350,,10,20,50,Dense,,0,,Sèche dure,stratifiée et irrégulière,,Inconnu,45.274188,6.635331
1370340719042,Duclos Alain,France,Haute Tarentaise,Col du Petit Saint Bernard,RD1090 ; aval du pont de la Marquise,W,02/06/2013,17:00,"Avalanche descendue spontanément en fin d'après midi. Elle a traversé la route d'accès au col du Petit St Bernard, qui avait été maintenus fermée par le Conseil Général de la Savoie.",false,0,Départ ponctuel,300,Réchauffement,,2300,,0,0,0,Dense,,2000,,Humide,,,Inconnu,45.66065,6.87758
1369683935351,Vescovi Thierry,France,Ecrins,Roche Faurio,,SE,26/05/2013,08:30,"Six randonneurs emportés, dont l'un totalement enfoui.
""Le leader nous prévient, je me met travers à la pente, espérant pouvoir résister. 2 secondes plus tard, la neige arrive, je résiste environ 1/2 seconde puis je suis emporté cul par dessus tête.
Gabin s'est mis face à la pente, il est le seul des 6 ayant été emportés à ne pas avoir été enseveli..""
(photos par plusieurs auteurs, impliqués dans l'avalanche ou arrivés juste après.)
",false,0,Plaque friable,60,Skieur rando.  montée,Neige,3550,,50,60,50,Dense,,0,,Sèche poudreuse,,,Inconnu,44.939026,6.359609
1368964425845,Duclos Alain,France,Haute Maurienne,Col du Mont Cenis,Pointe du Lamet - RD 1006,SW,19/05/2013,09:00,"Tirs préventif avant passage de la course cycliste Giro d'Italia.
Avalanches de peu d'ampleur, étant donnée les précipitations très abondantes des heures précédentes",false,0,,0,Grenadage hélico,Neige,2750,,0,0,0,Dense,,2450,,Sèche poudreuse,,,Inconnu,45.230694,6.981303
1368711239966,Duclos Alain,France,Beaufortain,Lac de Roselend,RD 217,W,15/05/2013,,"Les plaques de fond continuent à glisser dans ce secteur.
Celle ci est partie dans la nuit du 14 au 15 mai. D'ampleur modeste, elle marque néanmoins la poursuite de l'activité.",false,0,Plaque de fond,0,,,1690,,0,0,0,Dense,,1650,,Humide,,,Inconnu,45.694576,6.657728
1368691260666,Duclos Alain,France,Maurienne,Ouillon,Col du Glandon - RD 927,N,14/05/2013,17:00,"Minage habituel de la ""corniche"" du Glandon, avant travaux de déneigement.
Video avec le lien ci dessous.",false,0,,0,Minage de corniche,,1930,,0,3,0,Dense,,1730,,,Neige restée dure malgré le réchauffement diurne,,Inconnu,45.240671,6.172105
1367958151070,Duclos Alain,France,Maurienne,Grand Galibier,RD 902 - Valloire - Col du Galibier,NW,07/05/2013,15:00,"Plaque déclenchée par minage de la ""corniche"", en vue de sécuriser le secteur pour la course cycliste du GIRO d'Italia.",false,0,,0,Minage de corniche,Réchauffement,2670,,150,200,0,Dense,,2550,,,,,Inconnu,45.066437,6.411491
1367526106952,PGHM Modane,France,Vanoise,Grande Casse,Grands Couloirs,W,02/05/2013,10:30,"L'avalanche s'est déclenchée alors que les 4 alpinistes étaient proches de la sortie du couloir.
L'une des victimes n'a pas pu être sauvée.

La situation particulièrement piégeuse ce printemps (du moins en Savoie) se confirme dramatiquement.
Le PGHM redoute de nouveaux accidents, avec le beau temps annoncé pour le week end.

",false,0,,0,Alpiniste,,3550,,0,0,300,,,3100,,,,,Inconnu,45.402799,6.821122
1367264708837,Duclos Alain,France,Haute Maurienne,Pointe Longe Côte,,N,29/04/2013,,"Très nombreuses avalanches parties en journée, avec la pluie et les températures élevées.",false,0,,0,Réchauffement,Pluie,2700,,0,0,0,Dense,,2000,,Mouillée,,,3 - MARQUE,45.192959,6.771496
1367005579289,Duclos Alain,France,Beaufortain,Les Chapieux,Aiguille de Praina,N,25/04/2013,15:45,"Une des nombreuses purges observées cet après midi, après une nuit sans regel et une matinée faiblement pluvieuse.
Versant ombragés encore ""bien"" enneigés.
Altitudes indiquées approximatives.
",false,0,,0,Réchauffement,,2550,,0,0,0,,,1800,,Mouillée,,,3 - MARQUE,45.66317,6.756095
1366829622310,Duclos Alain,France,Maurienne,Grand Galibier,Plan Lachat ; Pointe du Vallon ; RD 902,N,21/04/2013,,"Une des purges consécutives aux abondantes chutes de neige du samedi puis au ""coup de chaud"" du dimanche. Départ linéaire ici. Des départs ponctuels ont aussi été observés.",false,0,,0,Réchauffement,Neige,2400,,40,0,0,Dense,,2000,,Humide,,,3 - MARQUE,45.077785,6.438145
1441179822077,Duclos Alain,France,Haute Maurienne,Col du Mont Cenis,RD 1006 Les Echelles,SE,21/04/2013,,"Attention : date incertaine (observation le matin du 25 avril).<br>
Avalanche spontanée qui a emporté des ouvrages de protection en bord de chaussée.",false,0,,0,,,1850,,0,0,0,Dense,,1795,,,Vielle neige mobilisée,,Inconnu,45.216867,6.955786
1366732536519,Denverpost.com,Etats-Unis,Colorado,Loveland Pass,,T,20/04/2013,,"Cinq personnes (4 snowboarders et un skieur) ont été tuées par une avalanche à proximité de Loveland Pass dans le Colorado. Les victimes participaient à un événement de snowboard backcountry appelé ""Rocky Mountain High Gathering Backcountry"". Plus d'infos dans le lien (en anglais) vers une description.",false,0,,0,,,0,,0,0,0,,,0,,,,,Inconnu,39.66361,-105.87917
1366308444893,Duclos Alain,France,Vanoise,Rateau d'Aussois,RD 215 - Avalanche de l'Apolonie,S,17/04/2013,,"Cette avalanche, qui descend rarement, a presque atteint la chaussée malgré un versant déjà très déneigé.",false,0,Départ ponctuel,0,Réchauffement,,2550,,0,0,0,Dense,,1300,,Mouillée,,,4 - FORT,45.218334,6.701644
1366268641260,Duclos Alain,France,Haute Tarentaise,Grande Sassière,Davie - RD 902,W,17/04/2013,16:00,"Déclenchement préventif d'avalanche sur route fermée d'accès à Tignes et val d'Isère.
Une avalanche avait atteint la chaussée la veille, signalée par un détecteur routier d'avalanches (DRA)
 <a href=""http://savoieactu.typepad.fr/mon_weblog/2013/04/d%C3%A9clenchement-davalanches-sur-la-route-de-tignes-val-dis%C3%A8re.html"">Voir la vidéo</a>",false,0,,0,Grenadage hélico,Réchauffement,2800,,0,0,0,Dense,,2100,,Mouillée,,,4 - FORT,45.513198,6.949871
1366295652333,Duclos Alain,France,Vanoise,Dent Parrachée,Pointe de Bellecôte - Col des Hauts,SE,17/04/2013,,"Une des nombreuses avalanches parties spontanément ces jours ci, plutôt en fin de journée.",false,0,,0,Réchauffement,,2880,,0,0,0,Dense,,2640,,Mouillée,,,4 - FORT,45.268895,6.745615
1366228530216,Conseil Général 05,France,Oisans,Col du Lautaret,La Liche,T,16/04/2013,,Ces différentes avalanches sont parties entre le 14 et le 16 avril. La photo est prise depuis la route départementale RD1091.,false,0,,0,Réchauffement,,0,,0,0,0,,,0,,,,,Inconnu,45.024722,6.429722
1366227782760,Conseil Général 05,France,Oisans,Pic de l'Homme,La Seuire,NE,16/04/2013,,"Une des nombreuses avalanches parties ces jours-ci dans le secteur du Lautaret.
<br> Le BRA indiquait un risque 3 évoluant en risque 4.",false,0,,0,Réchauffement,,0,,0,0,0,,,0,,,,,Inconnu,45.028611,6.331944
1366226694532,Conseil Général 05,France,Oisans,Col du Lautaret,La Madeleine - Monêtier-Les-Bains ,NE,16/04/2013,,"Une des nombreuses avalanches parties ces jours-ci. 
<br>Le BRA indiquait un risque 3 évoluant en risque 4 en journée.",false,0,,0,Réchauffement,,2150,,0,0,0,,,1800,,,,,Inconnu,45.030556,6.4283333
1366294155669,Duclos Alain,France,Vanoise,Dent Parrachée,Col des Hauts ; Aussois,SW,16/04/2013,,"Départ spontané, en fin de journée probablement.
Pas encore observé à cet endroit... selon les ""anciens""",false,0,Départ ponctuel,0,Réchauffement,,2950,,0,0,0,Dense,,2740,,Mouillée,,,4 - FORT,45.269723,6.752124
1367096901531,Duclos Alain,France,Haute Tarentaise,Tignes,Davie - RD 902,W,16/04/2013,19:30,"L'avalanche, rare (n'avait pas atteint la chaussée depuis mars 2006), a été signalée grâce à l'activation d'un détecteur routier d'avalanches (DRA). C'est pourquoi, après avoir vérifié son fonctionnement, la route a pu être dégagée puis ouverte à la circulation.
<a href=""http://www.youtube.com/watch?v=TO-iBNBhkfM"">Voir la video</a>
",false,0,,0,Réchauffement,,2800,,0,0,0,Dense,,1700,,Mouillée,,,4 - FORT,45.51149,6.936549
1367415320484,Merviel Alexandre,France,Ecrins,Aiguille de Lanchâtra,Combe de Moulin David - Avalanche n°116 de la CLPA de St Christophe en Oisans,T,16/04/2013,,"L'avalanche a été filmée depuis la Via Ferrata de St Christophe en Oisans.
Voir la vidéo dans le ""Lien vers une description"" et également le <a href=""http://www.skipass.com/news/89656-avalanches-de-printemps-.html"">lien vers le site Skipass<a/>.  <br>
Le BRA indiquait pour ce jour un risque de 3 évoluant en 4.",false,0,,0,,,0,,0,0,0,,,0,Dépôt dans le Vénéon.,,,,Inconnu,44.960278,6.165556
1366268031196,Duclos Alain,France,Maurienne,Mont Charvin,Paravalanche RD 926,NE,16/04/2013,,"La route étant fermée préventivement, une nouvelle avalanche a débordé le l'ouvrage paravalanche, pour atteindre la chaussée.",false,0,Plaque de fond,0,Réchauffement,,2150,,0,0,0,Dense,,0,,,,,Inconnu,45.218926,6.289742
1367094279435,Duclos Alain,France,Maurienne,Grand Galibier,Plan Lachat - RD 902 - Valloire - Col du Galibier,NE,15/04/2013,14:30,"Avalanche de plaque partie spontanément au cours d'un épisode très actif : nombreuses autres avalanches observées dans le secteur depuis le matin, parfois importantes.",false,0,,0,Réchauffement,,2120,,0,0,0,Dense,,1950,,Mouillée,,,4 - FORT,45.087113,6.434115
1366267707700,Duclos Alain,France,Maurienne,Mont Charvin,Paravalanche RD 926,E,15/04/2013,11:30,L'avalanche a débordé l'ouvrage de protection (casquette paravalanche),false,0,,0,Réchauffement,,2100,,0,0,0,Dense,,890,,Mouillée,,grosses branches,Inconnu,45.221868,6.303438
1366471787629,Becu Hugo,France,Ecrins,La Cucumelle,Vallons de la Cucumelle - Serre-Chevalier,T,15/04/2013,,"L'avalanche est descendue dans les Vallons de la Cucumelle et a débordé sur la piste des Vallons. Quelques arbres ont été pliés et emportés.
<br> Le BRA indiquait un risque de 3 évoluant en 4.",false,0,,0,Réchauffement,,0,,0,0,0,,,0,,,,,Inconnu,44.932384,6.510015
1366218761972,Presse Nice Matin,France,Mercantour,Cime du Chavalet,Hors-piste domaine skiable Auron - Sous le Télésiège du Dôme,T,15/04/2013,,"Deux skieurs qui évoluaient en hors-piste ont été emportés par une avalanche. Malheureusement, l'un des deux est décédé à la suite de ses blessures. D'après Nice Matin, l'avalanche mesurait ""300 mètres de long sur 50 mètres de large"". 
<br>Le BRA indiquait un risque 3 évoluant en 4.",false,0,,0,,,0,,0,0,0,,,0,,,,,Inconnu,44.228348,6.93298
1366134032683,Schwey Florian,France,Briançonnais,Le Janus,Couloir du Grand Réal - Montgenèvre - RN94,NW,14/04/2013,,"L'avalanche est partie après 18h (l'heure exacte n'est pas connue). Elle a fini sa course en bordure de la RN94.
Elle ne serait pas descendue aussi bas depuis au moins 20 ans.",false,0,,0,,,2450,Départ sous l'ancien fort du Janus,0,0,0,,,1453,,,,,4 - FORT,44.924178,6.69085
1367168145467,Juteau Jean-Pierre,France,Haute Tarentaise,Grande Aiguille Rousse,Pas du Bouquetin,S,14/04/2013,10:30,"L'avalanche a été déclenchée en haut du couloir en montée skis sur le dos. La personne a été emportée sur 150 m, elle en sortira fort heureusement indemne avec juste une grosse contusion à la jambe.
",false,0,Plaque friable,0,Alpiniste,,0,,30,0,30,,,0,,,,,3 - MARQUE,45.434186,7.113145
1366002677328,Duclos Alain,France,Haute Maurienne,Termignon,Signal du Petit Mont Cenis ; l'Erellaz,W,14/04/2013,17:15,"Très vaste avalanche de plaque, partie en fin de journée semble-t-il",false,0,,0,Réchauffement,,2950,,0,0,0,,,2450,,,,,3 - MARQUE,45.24998,6.82346
1365937868880,Presse Dauphiné Libéré,France,Vanoise,Dent Parrachée,Chaise du Pape. Pente sommitale,SE,14/04/2013,09:00,"Plusieurs skieurs de randonnée emportés, dont certains décédés ou dans un état grave.
Vaste plaque de neige sèche, plus ou moins croutée en surface.",false,0,Plaque friable,0,Neige,,3630,,20,0,150,Dense,,2900,,,,,3 - MARQUE,45.287942,6.754382
1367092837971,Viallet Michel,France,Maurienne,Roche Olvéra,Plan Lachat - RD 902 - Valloire - Col du Galibier,E,14/04/2013,15:30,"Avalanche importante déclenchée volontairement par minage de corniche, afin de sécuriser de déneigement de l'accès au col du Galibier",false,0,,0,Minage de corniche,Réchauffement,2550,,0,0,0,Dense,,1950,,Mouillée,,,4 - FORT,45.08576,6.424683
1365963562888,Duclos Alain,France,Haute Maurienne,Bessans,Claret,SE,14/04/2013,15:30,Encore un départ spontané de vaste avalanche de plaque,false,0,,0,Réchauffement,,2800,,0,0,0,Mixte,,1750,,,,,3 - MARQUE,45.334776,6.97685
1365951891160,Maitre Antoine,France,Vanoise,Rateau d'Aussois,,E,14/04/2013,16:00,"Après de multiples avalanches de moyenne ampleur tombées ces derniers jours, une autre de plus grande ampleur est tombée en cette fin d’après midi. Elle a traversé la route EDF et a fini sa course non loin du ruisseau saint Benoit.",false,0,Plaque de fond,550,,,2200,,0,0,0,,,1650,,Humide,,,4 - FORT,45.238978,6.717408
1367417022680,Vincent Jean-Michel,France,Haute Maurienne,Albaron,Itinéraire de montée par le Glacier des Evettes - Corniche Selle de l'Albaron,NE,14/04/2013,09:00,L'avalanche a été déclenchée par la rupture de la corniche et a traversé l'itinéraire de montée sous la Selle de l'Albaron. Voir le compte-rendu de la sortie sur Skitour dans le Lien vers une description.,false,0,,0,,,0,départ vers 3450 m d'altitude environ,0,0,0,,,0,,,,,3 - MARQUE,45.328333,7.108889
1365955621240,Presse Dauphiné Libéré,France,Champsaur,Mourre Froid,Col de la Montagne Haute - Prapic,T,13/04/2013,14:00,"Extrait du Dauphiné Libéré : ""Un skieur de randonnée, âgé de 60 ans et originaire du Rhône, est décédé dans une avalanche, ce samedi dans le Champsaur (Hautes-Alpes). L’accident a eu lieu vers 14 heures, plus précisément dans le secteur du Mourre Froid, au col de Montagne haute, à Prapic. Un secteur où les CRS des Alpes de Briançon s’étaient rendus plus tôt dans la journée. Une première avalanche leur avait été signalée à seulement quelques mètres du tragique accident dès 10 heures, hier matin. [...] Un ami qui l’accompagnait a également été emporté, mais il est sorti indemne de l’avalanche et a pu prévenir les secours, CRS des Alpes de Briançon.""
Le BRA indiquait un risque 2 évoluant en risque 3.",false,0,,0,,,0,,0,0,0,,,0,,,,,3 - MARQUE,44.640833,6.394167
1365793526341,Jouannot Dominique,France,Haute Maurienne,Bessans,Tierce,NW,12/04/2013,10:15,Une des multiples purges spontanées de ce jour.,false,0,,0,Réchauffement,,2200,,0,0,0,Dense,,1730,,Mouillée,,,3 - MARQUE,45.316477,7.003238
