Id,Observateur,Pays,Massif,Sommet/secteur,itinéraire,Orientation,Date,Heure,Description,Decl a distance,Distance décl,Caractéristique,Dénivelé,Origine principale,Origine secondaire,Alti départ,Commentaire zone départ,Epaisseur rupture,Epaisseur max rupture,Longueur rupture,Ecoulement principal,Commentaire type écoulement,Alti arrivée,Commentaire zone arrivée,Qualite neige,Commentaire qualité neige,Commentaire qualité transportée,Risque MF,latitude,longitude
50000547,Pietu Jacques,France,Aravis,Aiguille de Borderan,Combe de Borderan,T,04/12/2010,13:30:00,"Trois personnes ont été emportées par une avalanche alors qu'elles pratiquaient du ski de randonnée à proximité de la station de La Clusaz. Deux d'entre elles ont été blessées.Plus d'informations dans le PDF.Et surtout : lire le récit détaillé du CAF d'Annecy en ouvrant ""lien vers une description""",false,0,Plaque friable,400,Skieur rando.  descente,,0,,0,0,0,,,0,,,,,3 - MARQUE,45.885556,6.46
50000548,Duclos Alain,France,Aravis,Col des Aravis,,SE,01/12/2010,,"Série de plaques de fond parties entre l'après midi du 1er décembre et la matinée du 2.Les plaques en question étaient poudreuses jusqu'au fond, bien qu'un peu plus dense pour la partie la plus ancienne. Mince couche de glace à la base par endroits.... A permis aux chamois de trouver leur nourriture sans creuser !",false,0,Plaque de fond,0,Inconnue,,1555,,50,70,50,Dense,,1500,,Sèche poudreuse,,,Inconnu,0,0
50000573,Mainichi -,Japon,Japon - Hida Mountains,Tateyama,"""Yuki no Otani"" area",W,30/11/2010,,Un groupe de 2 skieurs et de 4 snowborders ont été emportés par une avalanche environ 700m sous le sommet du Tateyama (Sud-Est du Japon).Plus d'informations dans le PDF et le lien vers une description (en anglais).,false,0,Plaque friable,0,,,2400,,0,0,0,,,0,,,,,Inconnu,36.572778,137.622778
50000544,Florence -,France,Chablais,Haute Pointe,,T,28/11/2010,12:00:00,"Un peu plus tard que midi, une avalanche s'est déclenchée et a emporté deux personnes qui ont réussi à s'en sortir indemnes.Une des personnes ensevelies raconte ""Si j'avais une leçon à retenir de cette mésaventure : toujours l'arva sur la peau (le mien était sur mon tee shirt et une pâte a été arrachée par la force de la neige) et toujours la pelle montée à l'extérieure du sac car c'est toujours des secondes gagnées quand il faut faire peller pour déneiger et chercher quelqu'un...""",false,0,Plaque à vent,0,Raquettiste,,1850,L'avalanche a été déclenchée par un raquettiste depuis la crête.Une plaque à vent est partie et a entrainé par la suite une deuxième plaque à vent.,0,0,0,,,1600,L'avalanche faisait 150m de long environ.,,,,3 - MARQUE,46.175556,6.551944
50000545,Malpuech  Guillaume,France,Massif Central,Puy de Sancy,le long de l’arête entre Val de Courre et  Val d’Enfer,NW,28/11/2010,13:00:00,"Une skieuse de randonnée a été ensevelie jusqu'aux épaules à la suite d'une avalanche. Voir le très bon récit et l'analyse d'un des témoins sur Skitour dans le lien vers une description.Les photos ne sont pas prises le jour de l'avalanche mais permettent de situer sur le versant la zone de départ, la zone de dépôt et la position des skieurs au moment du déclenchement.",false,0,Plaque à vent,200,Skieur rando.  descente,,1750,Une plaque de 20/30 cm d'épaisseur sur 5 à 10 m de large est partie sur environ 30-40m de long.,20,30,5,Dense,Écoulement de neige poudreuse dans une pente à 35°/38°.,1550,Accumulation de 1 à 2 m. ,Sèche poudreuse,La neige était poudreuse soufflée par le vent.,,Inconnu,45.532778,2.801944
50000546,Askmo Pierre,France,Aravis,Tête Pelouse,Combe du Grand Crêt,NW,28/11/2010,11:30:00,"""Suddenly, I hear a thundering “CRACK” and everything under me and around me is in motion and accelerates at an amazing rate.""""j‘ai été pris dans une coulée a la (Combe du Grand Crêt) qui m’a envoyé a l’hôpital avec un péroné cassé (faible prix à payer considérant qu’a part mon visage et une partie de mon bras droit j’étais complètement ensevelis). [...]Ce qui ma choqué le plus sur place, c'est le caractère quasi imprévisible de cette coulée.""Il faut lire la description précise de Pierre sur son blog (Lien vers une description, en anglais)",false,0,,0,Skieur rando.  montée,,0,,40,70,150,,,0,,,,,Inconnu,45.912411,6.505893
50000542,,Italie,Appenins,Mont Cusna,,T,27/11/2010,,"Dans la matinée, deux skieurs-alpinistes ont été emportés et tués par une avalanche.Plus d'informations dans le PDF.",false,0,,0,Alpiniste,,0,,0,0,0,,,0,,,,,Inconnu,44.287994,10.391656
50000543,,Italie,Sobretta-Gavia,Mont Mortirolo,,T,27/11/2010,,"Quatre raquettistes ont été emportés par une avalanche, seul l'un d'entre eux en sortira indemne.Plus d'information dans le PDF.Cela porte le bilan à 5 morts dans le nord et le nord-est de l'Italie pour cette journée du 27 novembre 2010.",false,0,,0,Raquettiste,,0,,0,0,0,,,0,,,,,Inconnu,46.248056,10.299444
50000541,,Etats-Unis,Colorado,Glory Hole,,NE,22/11/2010,,Un directeur de service des pistes a été emporté et tué par une avalanche alors qu'il participait à un déclenchement préventif sur le domaine skiable de Wolf Creek (Colorado).Plus d'informations dans le PDF et le lien vers le site du Colorado Avalanche Information Center.,false,0,Plaque friable,0,,,3560,L'angle de la pente dans la zone de départ était de 45°.,0,0,0,,,0,,,,,Inconnu,37.460577,-106.800668
50000538,Duclos Alain,France,Haute Maurienne,Albaron,Glacier Supérieur du Vallonnet,N,17/11/2010,,"Départ spontané d'une immense plaque de neige sèche sous les Pointes du Grand Fond et la Crête d'Andagne. Elle rappelle celle du 4 avril 2007, en plus vaste mais moins épais.Attention à la grande instabilité qui règne en Haute Maurienne depuis le 1er novembre...",false,0,Plaque sur glacier,0,Neige,,3300,,0,0,1400,,,0,,,,,Inconnu,0,0
50000539,,Grande Bretagne,Cairngorm,Coire Cas headwall,,NW,15/11/2010,,"Information diffusée par David George, http://pistehors.com/Il faut regarder la video par ""lien vers une description"".Cas typique de plaque à vent sous le vent. Comme souvent dans ce cas là, le danger est palpable... mais ce n'est que dans l'accumulation qu'il y a du bon ski à faire....",false,0,Plaque à vent,0,Skieur rando.  descente,,900,,0,0,0,,,0,,,,,Inconnu,57.111976,-3.640693
50000536,Presse Dauphiné Libéré,France,Haute Tarentaise,Col de l'Iseran,Route fermée ; table d'orientation,NW,12/11/2010,08:15:00,"Véhicule emporté sur route fermée au public. Le conducteur est décédé. Un des passagers, qui était descendu, a aussi été emporté et grièvement blessé.",false,0,,70,Pluie,Neige,2550,Plaque de neige humide,0,0,50,Dense,,2470,,Humide,,,Inconnu,45.436506,7.007606
50000537,Pautas Roland,France,Haute Maurienne,Bessans,Pointe de Tierce,NW,12/11/2010,,Avalanche spontanée descendue dans l'après midi,false,0,,600,Réchauffement,Neige,2400,,0,0,0,Dense,,1800,,Humide,,,Inconnu,45.315629,7.006428
50000535,PGHM Modane,France,Haute Maurienne,Pointe du Lamet,Couloir de Roche Michel,N,01/11/2010,,"Trois alpinistes d'une même famille décèdent dans une avalanche partie dans le couloir de Roche Michel, accessible depuis leur village de Bessans.L'une des victimes était un professionnel particulièrement sensible aux problèmes d'avalanches ; il nous avait transmis d'excellentes photos pour data-avalanche. Quel triste début d'hiver...Merci au PGHM pour leur disponibilité et les observations réalisées.",false,0,Plaque friable,0,Alpiniste,,3100,,40,50,150,,,2400,Dépôt très épais au fond du couloir (>3 m). Neige très dense.,,Neige sèche en haut (neige récente poudreuse mais assez dense) ; humide en bas.,,Inconnu,45.2441,7.012539
50000569,Hendrilkx Jordy,New Zealand,Palmer Range,,,SE,04/09/2010,04:35:00,"Avalanches déclenchées par un tremblement de terre très intense (magnitude 6 à 7). Il a provoqué d'importants dégâts sur les bâtiments, mais sans victimes.Jordy rappelle des événements similaires dans ""The avalanche Review"" (vol 29 n°2, december 2010): - Mars 1964, Alaska, Magnitude 9.2- mai 1970, Pérou, Magnitude 7.8",false,0,,0,Tremblement de terre,,2000,,0,0,0,,,0,,,,,Inconnu,-42.22161,173.641678
50000528,Duclos Alain,France,Haute Maurienne,Col de l'Iseran,Aval du Pont de la Neige,S,31/05/2010,,"Avalanche relativement importante et exceptionnelle à cette époque, consécutive à de fortes précipitations.",false,0,,450,Neige,,2800,Départ linéaire net,0,0,0,Dense,,2350,,,neige récente + vielle neige,,Inconnu,45.402749,7.035762
50000527,Duclos Alain,France,Maurienne,Grand Galibier,,NW,26/05/2010,16:20:00,Minage de corniche dans le cadre de la sécurisation ds travaux de déneigement du Col du Galibier (Conseil Général de la Savoie).,false,0,,125,Minage de corniche,,2670,,0,0,0,Dense,,2545,,Mouillée,,,Inconnu,45.065675,6.410236
50000526,Auclair Alain,Italie,Haute vallée de la Susa,Rocciamelone ,Crocetta,S,24/05/2010,09:15:00,"Bien que la neige de cette face Sud-Sud-Est soit juste revenue après un bon regel nocturne (""moquette super bonne 5*""), l'un des trois skieurs déclenche une vaste plaque, qui en entraine au autre. Celui ci parviendra à s'arrêter, heureusement sans blessures graves.",false,0,,0,Skieur rando.  descente,,2600,,0,0,0,Dense,,0,,,,,1 - FAIBLE,0,0
50000525,Presse  La Stampa,Italie,Haute vallée de la Susa,Pointe Ferrand,Pointe Niblé,S,23/05/2010,13:00:00,"""Ça partait de partout"". Victime retrouvé en surface par les secours organisés, après environ 500m de ""toboggan"" avec l'avalanche. Sa vie n'est pas en danger.",false,0,,0,Skieur rando.  descente,,0,,0,0,0,,,0,,,,,1 - FAIBLE,0,0
50000524,Pautas Roland,France,Haute Maurienne,Pointes du Châtelard,"couloir de ""Resart"" ou ""Regirard"" ",T,22/05/2010,,Départ spontané en après midi,false,0,,0,Réchauffement,,0,,0,0,0,Dense,,1750,,Mouillée,,,Inconnu,0,0
50000522,Daumas Eric,France,Vanoise,Aiguille de Polset,Col de Gebroulaz,W,18/05/2010,10:00:00,"Photo d'ensemble le jour de l'avalanche (secours en cours) par Anne-Laure, postée sur Ski Tour.Photos d'ensemble 2 jours après l'avalanche par le guide Manu Guy.""Mardi 18 mai, au col de Gébroulaz(départ Val Thorens), température -5°c et beaucoup de vent, soleil, 10h du matin.Les 4 skieurs abordaient cette pente en une seule grande traversée de gauche à droite ( sens montée) avec espace 20 mètres sur neige dure. Déclenchement d'une plaque alors que le premier skieur le plus haut arrivait sur le plat. Un skieur enseveli tête en bas, les trois autres avec tête ou buste dehors. Skieur enseveli sorti par un groupe de 4 autres skieurs qui suivaient derrière.Deux blessés aux jambes.Section de la plaque de 60cm à 80 cm sur toute la largeur du col, 300m ?"" ",false,0,Plaque dure,80,Skieur rando.  montée,,3450,,60,80,400,Dense,,3370,,Sèche dure,,,Inconnu,45.277003,6.627114
50000520,Duclos Alain,France,Haute Maurienne,Belle Plinier,,N,06/05/2010,,"Plaque partie spontanément à la suite des chutes de neige du ""retour d'Est"". La rupture semble épaisse (elle aurait donc mobilisé également de la vieille neige ?).Horaire incertain, entre le 5 mai et le 6 en fin de matinée.Les pistes de la Norma atteintes étaient fermées, comme l'ensemble de la station à cette époque.",false,0,,200,Neige,,2550,,0,0,80,,,2350,,,,,Inconnu,0,0
50000517,Pautas Roland,France,Haute Maurienne,Pointes du Châtelard,Ravernotte,SE,25/04/2010,14:00:00,"Départ spontané dans le cirque du Chatelard, puis descendu dans le ruisseau de Ravernotte ",false,0,,0,Réchauffement,,3300,,0,0,0,Dense,,1750,,,,,2 - LIMITE,0,0
50000518,Marnezy David,France,Haute Maurienne,Pointe de Méan Martin,Pointe des Roches,NE,25/04/2010,18:20:00,Il semble que des coulées de surface aient entrainé le départ de vastes plaques.,false,0,,950,Réchauffement,,2800,,0,0,0,Mixte,,1850,,,,,2 - LIMITE,0,0
50000519,Michel Julien,France,Haute Tarentaise,Pointe du Lavachet,,N,25/04/2010,18:00:00,"Départ spontané de 2 vastes de plaques  en fin de journée, quasiment simultané.",false,0,,0,Réchauffement,,2400,,0,0,0,Dense,,0,,,,,2 - LIMITE,0,0
50000514,Duclos Alain,France,Maurienne,Ouillon,Col du Glandon,T,21/04/2010,16:04:00,Déclenchement préventif avant travaux de déneigement du Col par le Conseil Général de la Savoie,false,0,,0,Minage de corniche,,1930,,400,0,0,Dense,,0,,Mouillée,,,Inconnu,0,0
50000511,,France,Mercantour,Mont Archas,,T,18/04/2010,,"Une avalanche a entraîné la mort d'un skieur de randonnée sur le Mont Archas à 2500 m, dans les alpes maritimes.¨Plus d'infos dans le pdf.Photos prises le lendemain de l'avalanche.",false,0,,0,Réchauffement,,0,Les blocs restés en place montrent la raideur relativement faible de la pente (probablement autour de 30°).,0,0,0,,,0,,,,,3 - MARQUE,44.1158736362531,7.23705794083349
50000512,,Suisse,Valais,Zermatt,Schwarxtor,N,18/04/2010,14:20:00,"2 skieurs de randonnée sont emportés par une plaque. L'un des deux ne pourra pas être sauvé.Merci au guide Pierre Riche, qui passait par là, pour ses photos.",false,0,,0,Skieur rando.  descente,,2780,,70,0,80,Dense,,2580,,,,,1 - FAIBLE,45.959428,7.788654
50000510,David Lionel,France,Mont Blanc,Aiguille du Midi,Glacier Rond ,NW,16/04/2010,10:46:00,"Merci à Lionel David, qui nous a envoyé la première photo, vue depuis le Brévent. Les autres photos (vues depuis l'Aiguille du Midi) sont de Karine Payot.""Une immense avalanche d'environ 2.000 mètres de dénivelé a balayé la face nord (Nord-Ouest ?) de l'Aiguille du midi, faisant deux blessés de nationalité russe"".Voir le récit détaillé de Karine (fichier pdf)",false,0,,0,Chute de sérac,,3200,,0,0,0,Aérosol,,1300,,,,,2 - LIMITE,0,0
50000509,Laurent Louis,France,Mont Blanc,Dent du Géant,Glacier de la Noire,N,13/04/2010,11:28:00,"Avalanche probablement due à une chute de sérac. Photographiée par un skieur-alpiniste qui montait à la Brèche Puiseux, sur le versant en face.Merci au Guide Grégory, qui nous a informé.",false,0,,1000,Chute de sérac,,3500,,0,0,0,Aérosol,,2500,,,,,2 - LIMITE,45.871871,6.942344
50000503,Duclos Alain,France,Haute Maurienne,Pointe de Méan Martin,Buffettes,W,07/04/2010,14:12:00,Reprise des départs de plaques consécutives au réchauffement.,false,0,Plaque de fond,0,Réchauffement,,2350,,0,0,0,Dense,,1850,,Humide,,,2 - LIMITE,0,0
50000505,JANODY  Jeremy ,France,Aravis,Pointe des Verres,Au dessus de la Combe de la Torchère,NW,07/04/2010,,"""Aprés-midi T°c 8°c à environ 2300m, mais sensation de froid à cause d'une belle poudreuse!....Pente débonnaire et courte sur les crêtes des Aravis , orientation nord-ouest. J'ai sollicité la couche la moins épaisse a gauche sur la cassure, puis tout droit sur l'avalanche en traversant jusqu'en bas à droite ( cf photos vue de face. Après être sortie de la zone, j'ai perdu un ski, je suis tombé et le bord de l'avalanche m'a trainé sur 20  à 30m . Je suis sorti tout seul quand elle s'est arrêtée ( mais j'ai bien nagé)...Bilan: une grosse frayeur, et mes Legend Pro Rider sous 2,5 m de neige. Je reviendrais au printemps...""",false,0,Plaque friable,0,Skieur hors piste,,2425,,0,0,0,,,0,,Sèche poudreuse,,,2 - LIMITE,45.8898529218406,6.4883605083905
50000506,Presse Dauphiné Libéré,Suisse,Valais,Val d'Anniviers,,T,07/04/2010,11:30:00,"""Dans le secteur d'Ayer, près de Zinal, une avalanche a causé la mort d'un guide"".""[il]encadrait cinq randonneurs en hors-piste dans le secteur du col d'Arpettes, en direction du Val d'Anniviers.""",false,0,,0,,,0,,0,0,0,,,0,,,,,Inconnu,0,0
50000508,Dubois Philippe,Suisse,Grisons,Zenjiflue,sous le sommet du Weissfluhgipfel,NE,07/04/2010,10:00:00,"Un snowboarder est emporté par une très vaste plaque alors qu'il surfait une poudre de rêve. Heureusement, il est indemne et enfoui ""seulement"" jusqu'aux épaules.Il est secouru par les témoins... qui nous ont raconté l'histoire (voir le récit détaillé de Philippe dans le pdf).Intéressant de voir comment une ""première"" avalanche en a déclenché une autre, avec une exposition différente.",false,0,,0,Surfeur,,2800,,0,0,100,,,0,,Sèche poudreuse,,,Inconnu,46.8339019080372,9.79945220226266
50000502,Bonnevie Fred,France,Haute Tarentaise,,,SE,06/04/2010,10:18:00,2 amis empruntaient l'itinéraire de traversée pour aller randonner vers les Barmes de l'Ours depuis les remontées mécaniques de Bellevarde à Val d'Isère. Ils étaient à priori assez proches l'un de l'autre lorsque la plaque est partie: les 2 sont emportés. Lui reste en surface et perd du matériel ; elle est emmenée presque au fond du dépôt et n'a que la tête hors de la neige. Alerte transmise par des randonneurs qui évoluaient sur des pentes voisines. Pas de dégâts : Merci au service des pistes de Val d'Isère !,false,0,,0,Skieur rando.  montée,,2630,pente environs 30°,40,0,120,,,2540,"zone de dépôt allant de 1,5m à 3m",,,,2 - LIMITE,0,0
50000513,Schniewind Henry,France,Haute Tarentaise,Bellevarde,Chemin des Coves,N,06/04/2010,11:10:00,"Attention : D'après le responsable de l'opération de secours (et contrairement à la version d'Henry), l'avalanche aurait été déclenchée par 2 skieurs à 11:10, c'est à dire bien avant le passage du Snowboarder (14:30). En fait, le dépôt de cette avalanche aurait plutôt ""amorti le choc"". Elle ne serait pas à l'origine de l'accident.D'après Henry :""Après s'être rendu compte d'une erreur d'itinéraire, un snowboarder est emporté par une coulée alors qu'il tente de remonter. Il saute alors une barre rocheuse et n'est secouru, puis sauvé, que par miracle"".Lire le récit et les commentaires d'Henry (lien vers un description)",false,0,,0,Surfeur,,0,,0,0,0,,,0,,,,,2 - LIMITE,0,0
50000495,,France,Taillefer,Taillefer,Combe des Ramays,T,05/04/2010,,"Trois personnes ont été emportées par une avalanche en fin de matinée, dans la Combe des Ramays, menant au Taillefer. L’une d’elles âgée de 45 ans et originaire de la région Grenobloise est décédée. Une autre, souffrant d’une légère hypothermie et de contusions, a miraculeusement réchappé à la coulée de neige après avoir été traîné sur près de 800 mètres et sauté deux barres rocheuses.",false,0,,0,,,0,,0,0,0,,,0,,,,,3 - MARQUE,0,0
50000496,,France,Belledonne,,Lac du Crozet,T,05/04/2010,,"4 skieurs de randonnée ont été emportés par une avalanche dans le secteur du lac du Crozet. Un des skieur âgé de 53 ans, est décédé des suites de ses blessures.",false,0,,0,Skieur rando.  descente,,0,,0,0,0,,,0,,,,,3 - MARQUE,0,0
50000497,Mondon Gaël,France,Aiguilles Rouges,,face Nord du col de l'Encrenaz,NW,05/04/2010,13:12:00,"""Ce sont trois skieurs de randonnée qui ont disparu sous une avalanche aujourd'hui, sur la commune de Vallorcine, dans la face Nord du col de l'Encrenaz dans le massif des Aiguilles Rouges"".""Leurs corps ont été retrouvés à 14 heures au fond du vallon de Berard"".Merci infiniment à Gaël Mondon pour ses photos, qui permettent de mieux comprendre.",false,0,,0,Skieur rando.  descente,,2450,,0,0,0,Mixte,,1800,,Sèche poudreuse,,,3 - MARQUE,46.000921,6.888653
50000500,Doche Christian,France,Aravis,,,T,05/04/2010,11:30:00,"""départ probablement lié au passage de 4 skieurs au dessus (à la base ducouloir sous le sommet) , +  1 qui s'est trouvé pris dessous,visiblement indemne ,( depuis la Combe des Verts, trop éloignés pour un secours par nos soins, nous avions alerté les secours, un helico a été dépêché )"".Voir aussi le récit sur Skitour (lien vers une description).Belle mobilisation de la communauté montagnarde pour alerter sur la situation particulière de ces jours ci ! Merci.",false,0,,0,,,0,,0,0,0,,,0,,,,,Inconnu,0,0
50000501,,France,Belledonne,Grand Sorbier,,T,05/04/2010,,"3 skieurs de randonnées se sont fait emporter par une avalanche dans le secteur du Grand Sorbier. Ils ont dévalés plusieurs centaines de mètres de dénivelé, et s'en sortent avec des quelques hématomes. Plus d'informations dans le lien vers une description (skitour)",false,0,,700,Skieur rando.  montée,,0,,0,0,0,,,0,,,,,3 - MARQUE,0,0
50000504,Bruno ,France,Queyras,Pointe des Sagnes longues, Juste sous la créte de la Grande Sagne longue,SW,05/04/2010,11:30:00,"* Circonstance :    Grosses chutes de neige la veille : observation jusqu'à 80cm sous le col de la noire (versant N) vers 14h. Puis vent de nord fort durant la nuit et toute la matinée. Nombreux signes de fragilité observés sur de petites congères sous le vent de nord. Le cheminement de l'itinéraire de la Sagne longue permet de rester dans des pentes me semble-t-il inférieures à 25-30 °. Nous avons croisé de nombreuses accumulations en rasant les murs et celles présentes sous la crête alternaient avec des zones de neige dure, (ancienne  croute de regel). * Déclenchement. : En faisant la trace à la montée (20 m. sous la crête), pas plus de 30 cm de neige récente sous les skis. Petite hésitation, puis demi tour sur la trace pour rejoindre une zone plus rocheuse de la crête. .La cassure s'est produite juste sous la crète à la rupture de pente (25° d'inclinaison de pente à la cassure).* Ampleur : L'avalanche a coulé sur une centaine de mètres, me semble-t-il, sans produire d'accumulation importante.",false,0,,0,Skieur rando.  montée,,2840,,10,50,50,,,0,,,,,4 - FORT,0,0
50000507,Presse Dauphiné Libéré,Italie,Val Ferret,,"traversée du versant du Col Petit Ferret, qui mène au pied du mont Dolent",T,05/04/2010,,Un aspirant-guide  est décédé dans une avalanche alors qu'il évoluait dans un groupe composé de trois personnes...,false,0,,0,,,2700,,0,0,0,,,0,,,,,Inconnu,0,0
50000492,Duclos Alain,France,Haute Maurienne,Pointe d'Andagne,,N,02/04/2010,11:00:00,"De la neige et du vent, mais seulement des coulées de surface dans des pentes raides... jusque là.. que je sache...(les jours suivants ont malheureusement illustré l'établissement d'une forte instabilité)PS : la trace, c'est pas moi !",false,0,,0,Skieur hors piste,,2620,,0,0,0,Dense,,0,,Sèche poudreuse,,,3 - MARQUE,0,0
50000493,Presse Dauphiné Libéré,France,Beaufortain,Aiguille Croche,Montagne du rocher,S,02/04/2010,11:00:00,"Un skieur hors piste est emporté par une coulée puis localisé à l'ARVA par son compagnon. Bien que conscient lors de son dégagement, il succombera à ses blessures.",false,0,,0,Skieur hors piste,,0,,15,0,20,Dense,,0,"Victime retrouvée sous 1,5 m de neige.",,,,3 - MARQUE,0,0
50000491,Presse Dauphiné Libéré,Italie,Grand Paradis,Punta Grand Vaudala,Punta Balette,T,29/03/2010,,Cinq skieur de randonnée se font surprendre par une avalanche. Un homme du groupe ne pourra être sauvé. Plus d'info dans le PDF.,false,0,,0,Skieur rando.  descente,,2800,,0,0,0,,,0,,,,,Inconnu,0,0
50000494,PatdeGap ,France,Queyras,,,S,29/03/2010,,"Un randonneur à ski se fait prendre sous les yeux de ses copains :""Il s'est avancé vers le milieu de la face, passant d'une zone de neige transfo à une zone de neige meuble ; la plaque a pété sous ses skis et il a été immédiatement couché et emporté.""Voir le récit, les photos et les échanges sur SkiTour (lien vers une description).",false,0,,500,,,3300,"La pente, au niveau de la cassure, est d'environ 38°",0,0,0,,,2800,,,,,3 - MARQUE,0,0
50000540,,France,Champsaur,Mourre Froid,,N,28/03/2010,12:40:00,"Sous le sommet, à la descente, alors que le 1er skieur d'un groupe de 5 repart d'un point de regroupement, il déclenche, lors de son 1er virage, à distance une plaque qui partira au dessus de lui. Il arrive rapidement à se dégager ainsi que le second skieur. Les 3 autres skieurs, n'ont pas le temps de se sauver et sont emportés. Ils ne seront, fort heureusement, pas ensevelis mais secoués.",true,0,Plaque friable,150,Skieur rando.  descente,,2650,"L'ensemble de la couche de neige fraiche, 30-35cm, est parti.",0,0,0,,,0,Un replat permet à l'avalanche de s'arrêter 150m plus bas environ.,Sèche poudreuse,,,3 - MARQUE,44.6448,6.401067
50000488,Pautas Roland,France,Haute Maurienne,Pointe de Claret,Ruisseau de Claret,SE,26/03/2010,14:00:00,"Avalanche spontanée pendant le refroidissement : ""pluie le matin puis neige et vent de sud ouest de 10 heures 30 a 14 heures ; 11 cm de neige au relevée de 13.30 heures"" au village de Bessans.Les relevés nivo-météo sur le graphique sont ceux de la Sattion Flowcapt de Bonneval, située à environ 6 km de là. On remarque la baisse de température, le transport de neige par le vent et, bien sûr, l'augmentation d'épaisseur de neige dans la zone d'accumulation",false,0,,0,Inconnue,,0,,0,0,0,Dense,,0,,Mouillée,,,3 - MARQUE,45.330726,6.984092
50000487,Couloumy Sylvain,France,Vanoise,L'Arpette,Arcs 2000,SW,22/03/2010,15:15:00,Avalanche accidentelle provoquée par un surfeur hors piste. Cinq skieurs aval ont été emportés dont un jusqu'à la taille.Accumulation de plus de 5 m,false,0,,0,Surfeur,,0,,0,0,0,,,2144,,,,,3 - MARQUE,45.5679312848406,6.81321396259963
50000490,Presse Dauphiné Libéré,France,Oisans,Tête de la Toura,,T,22/03/2010,14:00:00, Plusieurs avalanches de forte ampleur se sont déclenchées spontanément. Plus d'info dans le PDF.,false,0,,0,Réchauffement,,2100,,0,0,0,,,0,,,,,Inconnu,0,0
50000485,Maitre Thierry,France,Vanoise,Rateau d'Aussois,,S,21/03/2010,,"Une avalanche de fonte s'est produite, dans le secteur du rateau d'Aussois, empruntant en seconde partie le couloir de Chatalamia. La zone d'arrivée se situe à quelques dizaine de mètres de la route Départementale 215 reliant Modane à Aussois.Avalanche dite ""de l'Apolonie""",false,0,,1350,Réchauffement,,2650,,0,0,0,Dense,,1300,,Humide,,,4 - FORT,45.2375568568207,6.69895446277377
50000481,Duclos Alain,France,Vanoise,Rateau d'Aussois,Plan d'Aval,E,20/03/2010,10:08:00,Nombreuses purges en fonte,false,0,,0,Réchauffement,,0,,0,0,0,Dense,,0,,Mouillée,,,2 - LIMITE,0,0
