Id,Observateur,Pays,Massif,Sommet/secteur,itinéraire,Orientation,Date,Heure,Description,Decl a distance,Distance décl,Caractéristique,Dénivelé,Origine principale,Origine secondaire,Alti départ,Commentaire zone départ,Epaisseur rupture,Epaisseur max rupture,Longueur rupture,Ecoulement principal,Commentaire type écoulement,Alti arrivée,Commentaire zone arrivée,Qualite neige,Commentaire qualité neige,Commentaire qualité transportée,Risque MF,latitude,longitude
1483792591473,Philippe Aigroz,Suisse,Alpes valaisannes,Ovronnaz,Tita Seri,NE,06/01/2017,13:50,"""Un randonneur à ski a été emporté par une avalanche, dans la région de « Tita Seri » en dessus d’Ovronnaz, à une altitude d’environ 2500m. L’infortuné a perdu la vie.

Deux randonneurs à ski sont montés au  » Tita Seri » (2850m). Lors de la descente, à une altitude d’environ 2500m, l’un d’eux s’est engagé en premier dans un couloir lorsqu’une avalanche (plaque à vent) de 400m de long sur une dizaine de mètres de largeur s’est déclenchée et l’a emporté. Alertés par des tiers, les secouristes se sont immédiatement rendus sur les lieux. Dans l’intervalle, un autre groupe de randonneurs est parvenu à localiser et à dégager sans vie la victime, ensevelie sous 3 mètres de neige.""<br>
Un témoin sur place ayant participé aux recherches précise que la victime est restée ensevelie environ 25 minutes et les secours sont arrivés sur place 35min après l'accident. ""J'estime le dénivelé de l'avalanche à un peu plus 300 m avec un gros dépôt assez peu étendu (probablement jusqu'à 4/5 m d'épaisseur par endroit). Ce jour-là, à ces altitudes, il y avait par endroit une couche de neige agréable à skier de 20 à 30 cm, parfois des accumulations un peu plus importantes, parfois des zones où de la vielle neige dure apparaissait.""",false,0,Plaque à vent,0,Skieur rando.  descente,,2500,,0,0,0,,,0,,,,,Inconnu,46.198872,7.100546
1485177043340,Jérémy Cherix,Suisse,Valais W - Alpes Pennines W,Pointe de Moline,,NW,06/01/2017,,"""Partit dans aucun but précis, on décide d'abord de partir vers le Col d'Hannibal étant donné le peu de monde ( 2 personnes devant). Ensuite cette face nous attiré l'oeil, du fait qu'elle était plus ventée que plaquée. Après un essai pour le sommet 3060, on a vite abandonné vu le manque et la qualité de la neige, pour rejoindre le point 2925. Depuis le haut on a nettement vu une partie dangereuse une centaine de mètres plus bas… 
Entrée un peu rocheuse mais sans problème puis bonne neige ventée ou fine couche de poudre. Arrivé à l'endroit sensible, il n'était pas question de continuer avec ça en dessus de nous. Je vois Luc qui veut passer au dessus de la ""plaque"" dans un but de déclenchement. Pensant avoir un meilleur échappatoire dans une neige stable sur ma gauche et une intuition très détendue, je prends les devants. Il aura fallu quand même 2 virages dans une neige excellente mais inhabituelle à skier, pour déclencher une plaque d'environ 20m de large et une cassure de 50cm au maximum. Pas tant plus de 30 secondes pour passer de 2800 à 2250 environ… Vu que la pente n'excédait pas les 40° sur cette portion je me suis facilement échappé. Il est peu pensable de le faire dans une pente plus raide. 
La suite comme le haut avant de trouver une neige plus qu'excellente dans les pentes de Troistorrents… Puis observation du dépôt, qui mesure quand même plusieurs centaines de mètres pour un épaisseur de 1 à 2 mètres. Principalement de neige poudreuse que la plaque a emportée avec elle. La cassure est bien visible du parking.""",false,0,,0,Skieur rando.  descente,,0,,0,50,0,,,0,Dépôt 1 à 2 mètres d'épaisseur,,,,Inconnu,45.89413,7.22342
1483633474456,Michel Rousseau,France,Queyras,Col des Portes,Départ du Laus - Casse des Oules,NW,25/12/2016,14:00,"Nous avons complètement sous-estimé le risque de formation de plaque à vent au cours des dernières 36 h, alors que nous avions randonné à proximité deux jours avant (col de Chaudemaison depuis Le Laus).
En outre, nous ne nous sommes pas donné de consignes entre nous avant d’engager la descente, même si aucun d’entre nous n’aurai eu l’idée de s’aventurer dans les pentes raides. J’avais plutôt pensé descendre à l’aplomb du col, dans un petit couloir parsemé de rochers où la neige avait déjà coulé  et qui me semblait à l’abri des grandes pentes qui descendent du sommet de Rochebrune. Mais le risque de toucher les cailloux était marqué et tout le monde n’est pas à l’aise dans ce genre de passage étroit. Par facilité, le groupe s’est engagé dans la traversée de montée et a poursuivi quelques mètres pour gagner une zone de neige durcie et dégagée de roches. Nous nous sommes trop rapprochés de l’axe de la pente, qui plus est à plusieurs, et l’avalanche s’est déclenchée aux premiers virages sautés… Heureusement nous étions en bordure de la coulée et un replat providentiel a stoppé la branche dans laquelle moi-même et un ami étions embarqué. Nous ramions en surface pour sortir de l’avalanche en rive gauche mais ce n’était pas facile avec les skis embarqués par la neige… 3 autres personnes avaient déjà descendu quelques virages et nous attendaient sur le replat situé sous le col. Une 4ème personne n’avait pas encore engagée la descente et a pu reculer sans être embarquée.
Autre chance énorme : personne ne nous suivait, car la trace de montée a été balayée par l’avalanche… C’est seulement ensuite que nous sommes rendu compte de l’ampleur de l’avalanche lorsque nous avons vu qu’elle avait poursuivi son déplacement beaucoup plus bas et que nous avons découvert sa largeur… 
On peut faire l’hypothèse que les pentes beaucoup plus larges situées plus à l’ouest sous la partie sommitale pourraient très bien partir également… Ce qui a renforcé notre décision d’informer la communauté montagnarde de cette avalanche.<br>
Voir également le document en lien du récit rédigé le 03/01.
",false,0,Plaque à vent,0,Skieur rando.  descente,,2950,largeur cassure estimée à 50m - épaisseur estimée : mini 30cm / max 60cm,0,0,0,Dense,,2750,Dénivelé estimé à 150-200m; ,Sèche dure,,,3 - MARQUE,44.820492,6.781998
1482657578531,Jean Marc Chevilley,France,Haute Maurienne,La Norma,"Hors-pistes, secteur des Crêtes",N,23/12/2016,14:30,"Suite aux chutes de neige du début de semaine j'ai attendu trois jour pour m'engager sur la face qu'on peut prendre depuis Norma 2 et qui arrive au milieu de la piste des crêtes (est nord est), celle juste après le couloir.

Ce vendredi début d'après-midi il y avait déjà une dizaine de traces, rien n'avait bougé :
- 14h, je fait une première descente de cette face en mode repérage, aucun bruit et rien ne bouge. Pas mal de cailloux qui laissent penser que c'est pas très épais, pas de grosse accumulation et rien d'inquiétant.
- 14h30 rassuré par cette première descente je repars pour un deuxième tour plus engagé, je me décale de 2m au départ juste sous le gazex g6, pour tourner dans la poudreuse avec de la vitesse et à la fin du virage tout part 
- le point de départ se situe dans ma trace, j'ai touché la couche fragile, ça a tout cisaillé et je suis dessous, ça part de partout et reste plus qu'à tirer l'airbag
- le point de départ est à 2600m, l'avalanche fait 30m de large sur 200m de long, j'ai fait environ 150m en passant par dessus les cailloux 
- à la cassure environ 40cm ( 5cm rapportés par le vent, 30cm homogènes correspondants à la dernière chute et dessous 3cm de grains à face plane sans aucune cohésion
",false,0,Plaque friable,0,Surfeur,,2600,,40,0,30,,,2400,,,,,3 - MARQUE,45.182182,6.716245
1482526535484,Presse Dauphiné Libéré,France,Champsaur,Col des Pisses,,N,23/12/2016,15:00,"Un groupe de 3 personnes s'est  fait surprendre par une avalanche dans les pentes nord, sous le col.
Plus d'infos sur le lien suivant.",false,0,,0,,,2750,,0,0,0,,,0,,,,,2 - LIMITE,44.73235,6.324393
1482590726323,Presse quotidianopiemontese,,,Limone Piemonte,Vallone delle Giosolette  Seguici,T,23/12/2016,11:15,"""8 skieurs et 2 guides de montagne qui effectuaient une descente après avoir été déposés en altitude par hélicoptère. L'avalanche de grandes dimensions s'est déclenchée à 2400 m dans la vallée de Giosolette au pied du mont Ciamoussé et a emporté 3 personnes. Deux d'entre elles ont réussi à sortir de façon autonome ; la troisième est décédée.",false,0,,0,Skieur hors piste,,2400,,0,0,0,,,0,,,,,3 - MARQUE,44.173169,7.557169
1482588237347,Nicard François,France,Queyras,Col de Furfande,Rive droite Torrent du Plan du Vallon - Arvieux,N,22/12/2016,,"Plaque déclenchée lors du passage du 2ème skieur à la descente, partie sous les pieds; il ne s'est rien passé lors du passage du 1er. Ils ont réussi à s'échapper.",false,0,Plaque friable,0,Skieur rando.  descente,,2380,Cassure de quelques cm à presque 60cm. 50 mètres de large environ,0,60,50,Dense,,0,Accumulation dans un goulet en dessous - Environ 100 m de denivelé,,,,Inconnu,44.73775,6.716472
1482516118392,Coubat Grégory,France,Haute Maurienne,Pointe d'Andagne,,W,22/12/2016,16:00,"Poudre de rêve et grande chance pour ce skieur emporté lors de sa descente d'une pente inclinée à environ 40°. Son excellent niveau lui a permis de s’échapper sans dommages. Ouf !<br>
Première photo depuis hélicoptère par le guide Marc Malvolti. Merci !<Info complémentaire par secouristes CRS Briançon : ""Aucune victime à déplorer mais il faut noter que ça part de partout dans la grande moitié Nord.
Comme sur les photos des deux autres avalanches que tu as mis en ligne, la nouvelle couche part en plaque sur la couche fragile présente à la surface de l'ancien manteau neigeux"". <br>
Plusieurs avalanches accidentelles signalées aussi dans le secteur de Valfréjus, depuis le ""retour d'Est"" de lundi et mardi dernier.",false,0,Plaque friable,0,Skieur rando.  descente,,3000,,30,50,20,,,2850,,Sèche poudreuse,Neige récente poudreuse sur couche fragile en gobelets.,,3 - MARQUE,45.349196,7.059148
1482590001119,Service des pistes Valfréjus,France,Haute Maurienne,Valfréjus,"Punta, entre télésiège et ligne électrique",N,22/12/2016,,"Déclenchement par un skieur hors piste, qui s'en sort indemne. Ouf !",false,0,Plaque friable,0,Skieur hors piste,,2475,,40,80,50,,,0,,Sèche poudreuse,,,3 - MARQUE,45.14856,6.670788
1482589072483,Service des pistes Valfréjus,France,Haute Maurienne,Valfréjus,Hors piste de la Banane,N,21/12/2016,,"Le fort rider qui s'est fait surprendre par l'avalanche s'en est sorti grâce à la chance et à son très bon niveau, cette fois.",false,0,Plaque friable,0,Skieur hors piste,,2600,,50,100,0,,,2350,,Sèche poudreuse,,,3 - MARQUE,45.145714,6.667998
1482356406225,Coubat Grégory,France,Queyras,Abriès,Torrent de la Lauze,E,21/12/2016,15:26,"Une des petites plaques déclenchées à plus de 200 de notre position (amorce de rupture). Excellente poudre dessus. Couche fragile mince et redoutable, mais parfaitement identifiable, en dessous.<br>
Attention à la situation très instable qui s'est instaurée dans le secteur : évolution à surveiller !<br>
Info complémentaire par secouristes CRS Briançon : ""Aucune victime à déplorer mais il faut noter que ça part de partout dans la grande moitié Nord.
Comme sur les photos des deux autres avalanches que tu as mis en ligne, la nouvelle couche part en plaque sur la couche fragile présente à la surface de l'ancien manteau neigeux>",true,200,Plaque friable,0,Skieur rando.  montée,,2195,,0,40,10,Dense,,0,,Sèche poudreuse,Couche fragile enfouie mince mais très bien marquée.,,Inconnu,44.775652,6.914957
1482355876585,Coubat Grégory,France,Queyras,Abriès,Torrent de la Lauze,NW,21/12/2016,15:25,"Après avoir ressenti et entendu plusieurs ""woumph"" lors de notre progression, toute une série de plaques et de fissures se sont brutalement produites autour de nous. Cette plaque était la plus proche, sur le versant opposé à nous. Ces événements illustrent la forte instabilité dans le secteur, avec des couches fragiles enfouies très bien formées, sous l'excellent poudre issue du dernier retour d'Est (hier).<br>
Info complémentaire par secouristes CRS Briançon : ""Aucune victime à déplorer mais il faut noter que ça part de partout dans la grande moitié Nord.
Comme sur les photos des deux autres avalanches que tu as mis en ligne, la nouvelle couche part en plaque sur la couche fragile présente à la surface de l'ancien manteau neigeux>",true,80,Plaque friable,0,Skieur rando.  montée,,2190,,0,40,20,Dense,,0,,Sèche poudreuse,,,Inconnu,44.776662,6.915583
1482599685907,CRS Alpes,France,Ecrins,Les Bans,Refuge de la Pilatte,NE,20/12/2016,20:00,"""Trois personnes ont passé la nuit dehors après avoir déclenché une plaque de 300m de large et 70cm/1m d'épais. Deux se sont vites arrêtés tandis que le 3ème a sauté une barre de 80m (fracture de mâchoire et tassement cervical)"".<br>
""Le blessé n'arrivant pas a descendre, seul l'un des trois est parti donner l'alerte a la Bérarde au petit jour"".<br>
Peu ou pas de précipitations avant l'avalanche, mais forts vents.<br>
""Le risque en Oisans mardi etait de 1 en dessous de 2500m et de 2 au dessus""",false,0,,0,Alpiniste,,2600,,70,100,300,,,0,,,,,2 - LIMITE,44.870418,6.331089
1480683453738,Rogier van Rijn,France,Ecrins,Tête de Vautisse,Sous les Terres Noires,N,27/11/2016,,Avalanche spontanée observée par deux randonneurs. Date de l’événement incertaine: entre le 27 et le 28 novembre.,false,0,,180,Inconnue,,2650,,80,100,0,,,2470,,,,,Inconnu,44.6962139,6.51570833333333
1480271317002,Laffon Julie,France,Grandes Rousses,Pic Blanc,,NW,26/11/2016,,"Avalanche partie spontanément en fin de nuit/début de journée du 26.
(photo prise le 27/11 depuis l'arrivée du téléphérique de Vaujany)",false,0,,0,Neige,Vent,0,,0,0,0,,,0,,,,,Inconnu,45.125375,6.127646
1480604185379,Coubat Grégory,France,Mont Thabor,Grand Argentier,,N,26/11/2016,,Avalanche de grande ampleur partie après l'épisode de mauvais temps par déclenchement artificiel lors de la sécurisation du domaine skiable de Valfréjus. Seul tir positif sur 52 réalisés...,false,0,Plaque friable,0,Grenadage hélico,Neige,2920,,100,0,0,,,2350,,Sèche poudreuse,,,Inconnu,45.131391,6.657804
1480274073434,Laffon Julie,France,Grandes Rousses,Pic Bayle,Glacier des Rousses,NW,26/11/2016,,"Avalanche partie spontanément en fin de nuit/début de journée du 26.
(photo prise le 27/11 depuis l'arrivée du téléphérique de Vaujany)",false,0,,0,Neige,Vent,0,,0,0,0,,,0,,,,,Inconnu,45.140754,6.134834
1480268173290,Deschanel Guillaume,France,Vanoise,Pointe de Thorens,"Hors-piste station de Val Thorens, à l'Est du Col du Bouchet sous la pointe côté 3076 m",NW,26/11/2016,14:40,"""Plaque déclenchée sous mes yeux par le passage d'un skieur, il s'est échappé facilement en prenant de la vitesse tout droit.

De nombreuses plaques ont été déclenchées dans le secteur lors de la sécurisation du domaine PIDA par le service des pistes de la station.""<br>
Danger d'avalanche BERA : risque non chiffré en ce moment.",false,0,Plaque à vent,90,Skieur hors piste,,3020,,0,0,0,Dense,,2930,,,poudreuse - signes de vent en surface,,Inconnu,45.267223,6.60111
1480194182915,Coubat Grégory,France,Haute Maurienne,Bessans,Prateis ?,SE,25/11/2016,,Un des départs spontanés sous forme de plaque de fond épaisse.,false,0,Plaque de fond,0,Neige,,2100,,0,0,0,Dense,,0,,Humide,,,Inconnu,45.331853,6.993328
1480882012698,Duclos Alain,France,Queyras,,Torrent de Maloquestre,NE,25/11/2016,,Avalanche spontanée descendue lors de l'épisode de fort retour d'Est du 24 et 25 novembre. - Enjeux : RD 947 (Approché),false,0,,0,Neige,,2700,Non observé - imprécis,0,0,0,,,1900,important volume de neige,,,,Inconnu,44.75775,6.98343
1480193435463,Coubat Grégory,France,Haute Maurienne,Ouille Allegra,Bessans - La Grangette,W,25/11/2016,16:35,"Une des nombreuses purges spontanées qui se sont produites pendant l'épisode de retour d'Est très actif, et se sont poursuivies au moins quelques heures après la fin totale des précipitations.",false,0,,0,Neige,,2400,,0,0,0,Dense,,1800,,Humide,,,Inconnu,45.331459,7.033686
1481045907019,Coubat Grégory,France,Haute Maurienne,Pointe d'Andagne,RD 902 ; Bériond,W,25/11/2016,07:30,"Avalanche spontanée de grande ampleur, exceptionnelle bien qu'elle n'ait pas atteint la chaussée. ",false,0,,0,Neige,,3050,,0,0,0,Mixte,,1790,,,"Sèche poudreuse en haut, humide en bas",,Inconnu,45.351584,7.057345
1480363201973,Coubat Grégory,,,Grand Galibier - Rif Blanc,RD 1091 - Tunnel du Rif Blanc,SW,25/11/2016,,"Nombreuses ruptures de plaques, pour une avalanche assez importante mais qui n'a pas atteint la chaussée. <br> RD 1091 fermée préventivement ; passage obligatoire par les tunnels. - Enjeux : RD 1091 (Approché)",false,0,,0,Neige,,2800,,80,0,0,,,2020,,,Neige sèche dans la zone de départ,,Inconnu,45.044822,6.429636
1481816811191,Coubat Grégory,France,Haute Maurienne,Pointes du Châtelard,,S,25/11/2016,,Vaste avalanche partie naturellement pendant l'épisode perturbé du 24 et 25 novembre 2016.,false,0,,0,Neige,,3350,,80,0,0,,,2250,,,,,Inconnu,45.327452,6.949111
1480074174136,Coubat Grégory,France,Vanoise,Dent Parrachée,Ruisseau du Pisset,E,25/11/2016,,Une des nombreuses avalanches spontanés de ces 2 jours de fort retour d'Est (24 et 25 novembre 2016).,false,0,,0,Neige,,2200,,80,0,0,,,1450,,,,,Inconnu,45.292354,6.790086
1481486604495,Anselmet Yannick,France,Haute Maurienne,Pointe des Arses,Chalets de Camasse et des Parses,W,25/11/2016,,"Une des multiples avalanches qui se sont produites lors du retour d'Est des 24 et 25 novembre.<br>
... Comme quoi il ne faut construire ni n'import où, ni n'importe comment.<br>
Photos prises plus de 2 semaines après l'avalanche.",false,0,,0,Neige,,2900,,0,0,0,,,2170,,,,,Inconnu,45.395642,7.051869
1480357533149,Régis Philip,,,Col du Lautaret - Vallois,RD1091 ; Tête de Colombe,W,25/11/2016,,Avalanche importante probablement partie entre le jeudi 24 fin de journée et le vendredi 25. Départ en vastes plaques dans le secteur de Tête de Colombe.<br>Route fermée préventivement : passage obligatoire par les tunnels. - Enjeux : RD 1091 (Approché),false,0,Plaque friable,0,Neige,,2900,,0,0,0,,,1930,,,,,Inconnu,45.039232,6.432967
1480881425886,Coubat Grégory,France,Queyras,,Ruisseau de la Chapelle - La Monta,S,25/11/2016,,Avalanche partie naturellement pendant les deux jours de fort retour d'Est (le 24 ou 25 novembre). - Enjeux : RD 947 (Approché),false,0,,0,Neige,,2700,Zone de départ non observée,0,0,0,,,2000,,,,,Inconnu,44.774864,6.994145
1480002381597,Duclos Alain,France,Haute Maurienne,Bessans,Proximité Ruisseau de la Frette,W,24/11/2016,,Crue avalancheuse en situation de retour d'Est,false,0,,0,Neige,,0,,0,0,0,Dense,,1750,,Humide,,,Inconnu,45.335666,7.031417
1480006053469,Duclos Alain,France,Haute Maurienne,Pointes du Châtelard,RD 902 ; Prés de rebon,SE,24/11/2016,12:00,"Une des plus grosse avalanches lors de cette première journée de crue avalancheuse simultanée au ""retour d'Est"" en cours;",false,0,,0,Neige,,0,,0,0,0,Dense,,1690,Dépôt dans le cours de l'Arc,Humide,,,Inconnu,45.325319,6.976239
1479999194265,Duclos Alain,France,Haute Maurienne,Bessans,RD 902 ; Ruisseau de Proveral,SE,24/11/2016,10:50,"Une des nombreuses avalanches spontanées, plus ou oins grosses, dues à l'épisode de fortes précipitations en cours (retour d'Est)",false,0,,0,Neige,,2800,,0,0,0,Dense,,1750,,Humide,,,Inconnu,45.335144,6.992905
1479836463853,Régis Philip,France,Oisans,Pic de Combeynot,Torrent de la Liche,NE,22/11/2016,11:00,Une des avalanches spontanées qui se sont produites lors de la crue avalancheuse entre 11:00 et 12:00. Écoulement jusque dans la Guisane.,false,0,,0,Neige,,0,,0,0,0,Dense,,1790,,Humide,,,Inconnu,45.029876,6.438387
1479119473791,George David,France,Haute Tarentaise,Grande Motte,,NE,12/11/2016,,Déclenchement préventif pour la sécurisation des pistes,false,0,Plaque à vent,0,Grenadage à main,,3550,,0,250,0,,,0,,,,,Inconnu,45.411619,6.873262
1476723885631,Henry Tof,France,Mont Blanc,Vallée Blanche,Petit Flambeau,SE,17/10/2016,,""" Dans cette vidéo prise dans le massif du Mont Blanc et plus exactement dans le secteur du Petit Flambeau on voit une grosse avalanche se déclencher, heureusement sans faire de victime. Du moment que la neige est là et que vous vous trouvez en montagne les dangers sont présents qu'importe la période""<br>
Une chose est sûre : il ne sert absolument à rien de rechercher des indices d'instabilité dans ces circonstances ! Neige récente et pente à plus de 30° devraient suffire à éveiller la vigilance (pour induire des précautions comme ici : un par un, sous surveillance, etc.). Mais comment le faire admettre ???<br>
Voir l'excellente vidéo en cliquant sur le lien ci dessous.",false,0,Plaque friable,0,Skieur hors piste,,3500,,40,0,0,Mixte,,0,,Sèche poudreuse,,,Inconnu,45.877984,6.899612
1476633479718,Duclos Alain,Italie,Valle Argentera,Bersezio,Forêt,NE,15/10/2016,13:45,"Avalant de neige récente humide suite aux précipitations abondantes dans le secteur.<br>
Attention : cette couche pourra constituer une couche fragile durable dans les pentes où elle subsistera (à l'ombre et en altitude ?)",false,0,Départ ponctuel,0,Neige,Réchauffement,1830,,40,0,15,Dense,,1700,,Humide,,,Inconnu,44.380557,6.961925
1473841347190,,Cachemire-Inde,Himalaya,Aru Range,,T,16/07/2016,,"D'après le site Kairn.com :
""Il s'agît de l'une des avalanches glaciaires les plus importantes jamais répertoriées. Plus de 100 millions de m3 de glace et de roche sont tombés le 17 juillet dernier dans une vallée étroite de la région de Rutog, à l'ouest de la province autonome du Tibet. Selon Zong Jibaio, glaciologue à ll'Institut de recherche du plateau tibétain (ITPR) qui s'est rendu sur place, la glace recouvre près de 10Km2 pour une épaisseur de 30m.  la glace est descendue dans une gorge étroite avant d'atteindre le lac de Co Aru, à 6 kilomètres de distance."" 
Article complet sur le lien suivant.",false,0,,0,,,6000,,0,0,0,,Ecoulement de 6km de long,4900,,,,,Inconnu,34.022727,82.246812
1469047323822,Presse Paris Match,,Chili,Farrellones,,T,14/07/2016,,"""La championne de ski freeride, Matilda Rapaport, a succombé à ses blessures. Elle avait 30 ans. Le 14 juillet dernier, elle avait été prise dans une avalanche au cours d’un tournage publicitaire au Chili. «Matilda est restée sous la neige un long moment, est tombée dans le coma et est décédée des suites de complications consécutives au manque d'oxygène», a indiqué la Fédération. Transportée en urgence à l’hôpital, elle n’a pas survécu.<br>Ancienne skieuse alpine, elle était devenue un membre éminent de la communauté freeride en intégrant les premières places du Freeride World Tour.<br>C’est la deuxième fois depuis le début de l’année que le Freeride World Tour est endeuillé. ",false,0,,0,,,0,,0,0,0,,,0,,,,,Inconnu,-33.299709,-70.249953
1473233521732,Coubat Grégory,France,Vanoise,Pointe du Génépy,Passage du Rosoire,SE,25/06/2016,,"Avalanche partie naturellement quelques jours après un long épisode de mauvais temps. La pente avait été parcouru à pied la veille.
Photos prises quelques jours plus tard (le 30 juin et le 16 juillet).",false,0,,0,,,3430,,200,0,0,Dense,,3150,,,,,Inconnu,45.300786,6.734552
1466505522047,Presse Dauphiné Libéré,France,Mont Blanc,Mont Blanc du Tacul,Face Nord - voie normale,NW,20/06/2016,11:30,"""La personne décédée est un skieur d’origine néo-zélandaise. L’homme était en phase d’ascension du Mont-Blanc du Tacul quand il a été emporté par cette avalanche de plaque"".<br>
""L’avalanche pourrait avoir été déclenchée par deux militaires du PGHM de Chamonix. """,false,0,Plaque friable,0,,,4020,,50,80,150,Mixte,,2820,,,,,Inconnu,45.860717,6.88578
1465317514101,Duclos Tom,France,Haute Maurienne,Pointe Longe Côte,,N,07/06/2016,,"Vaste avalanche de vieille neige partie spontanément. Attention : forte chaleur en cours avec nuits sans regel (ciel nocturne couvert)... et il reste pas mal de neige dans certaines pentes ombragées d'altitude.<br>
Les couches fragiles de début de saison fonctionnent encore.",false,0,,0,Réchauffement,,2900,,0,0,0,Dense,,2350,,Humide,,,Inconnu,45.191448,6.770876
1464607512663,Perceval Christophe,France,Lauzière,Col de la Madeleine,RD 213 - Couloir des Ardoisières,NE,29/05/2016,,"Glissement de plaque de fond, qui s'avère systématique.<br<
A traversé la chaussée qui avait été maintenue fermée préventivement à cause de ce risque. <br>
Aussi quelques photos prises 3 jours avant l'avalanche.",false,0,Plaque de fond,0,Réchauffement,,1950,,0,0,0,Dense,,1880,,Humide,,,Inconnu,45.445088,6.377864
1464593751823,Frédéric Chevallier,France,Maurienne,Col du Galibier,RD 902 -déviation col,NW,25/05/2016,12:00,Encore une plaque assez importante déclenchée par la surcharge de la pente en aval par les engins de déneigement. <br> Lacet en aval traversé par l'écoulement. Route fermée au public et vigilance du personnel. ,false,0,,0,Engin de déneigement,,2635,,0,0,50,Dense,,2580,,Humide,,,Inconnu,45.065188,6.409853
1464592975963,Frédéric Chevallier,France,Maurienne,Col du Galibier,RD 902 -déviation col,T,24/05/2016,15:30,"Déclenchement pendant les travaux de déneigement, provoqué par la surcharge dans la pente avec l'engin de fraisage.",false,0,,0,Engin de déneigement,,2635,,0,0,60,Dense,,2615,,Humide,,,Inconnu,45.0645,6.408646
